{
  "$schema": "https://json-schema.org/draft/2020-12/schema",
  "title": "HarnessEvidenceBundle",
  "type": "object",
  "required": [
    "timestamp",
    "task_id",
    "checks",
    "artifacts"
  ],
  "properties": {
    "timestamp": {
      "type": "string"
    },
    "task_id": {
      "type": "string"
    },
    "checks": {
      "type": "array",
      "minItems": 1,
      "items": {
        "type": "object",
        "required": [
          "name",
          "status"
        ],
        "properties": {
          "name": {
            "type": "string"
          },
          "status": {
            "type": "string",
            "enum": [
              "pass",
              "fail"
            ]
          },
          "details": {
            "type": "string"
          }
        }
      }
    },
    "artifacts": {
      "type": "array",
      "items": {
        "type": "string"
      }
    },
    "review": {
      "type": "object",
      "properties": {
        "self_reviewed": {
          "type": "boolean"
        },
        "secondary_reviewed": {
          "type": "boolean"
        }
      }
    }
  }
}
