{
  "timestamp": "2026-02-12T02:25:44Z",
  "task_id": "unknown-task",
  "checks": [{"name":"agent_self_review","status":"pass","details":"self review completed"}],
  "artifacts": [".ralph/activity.log",".ralph/errors.log"],
  "review": {
    "self_reviewed": true,
    "secondary_reviewed": false
  }
}
